{
  "schema_version": "1.0",
  "collected_at_utc": "2026-08-08T17:00:00+00:00",
  "hostname": "TEST-HOST",
  "checks": {
    "operating_system": { "status": "success", "data": { "Caption": "Windows 11", "Version": "10.0", "BuildNumber": "26200", "OSArchitecture": "64-bit" }, "message": null, "duration_ms": 1.0 },
    "cpu": { "status": "success", "data": [{ "Name": "Test CPU", "NumberOfCores": 8, "NumberOfLogicalProcessors": 16 }], "message": null, "duration_ms": 1.0 },
    "memory": { "status": "success", "data": { "TotalVisibleMemorySize": 33554432, "FreePhysicalMemory": 16777216 }, "message": null, "duration_ms": 1.0 },
    "storage": { "status": "success", "data": [{ "DeviceID": "C:", "VolumeName": "System", "Size": 1099511627776, "FreeSpace": 549755813888 }], "message": null, "duration_ms": 1.0 },
    "python": { "status": "success", "data": { "version": "3.12.0", "implementation": "CPython", "executable": "C:\\Python\\python.exe" }, "message": null, "duration_ms": 0.0 },
    "git": { "status": "success", "data": { "version": "2.55.0" }, "message": null, "duration_ms": 1.0 },
    "nvidia_gpu": { "status": "success", "data": [{ "name": "Test GPU", "driver_version": "600.0", "memory_total_mib": 16000, "utilization_gpu_percent": 10, "temperature_celsius": 40 }], "message": null, "duration_ms": 1.0 },
    "system": { "status": "success", "data": { "Manufacturer": "Test Maker", "Model": "Test Model" }, "message": null, "duration_ms": 1.0 },
    "bios": { "status": "success", "data": { "Manufacturer": "BIOS Maker", "SMBIOSBIOSVersion": "1.0", "ReleaseDate": "2026-01-01" }, "message": null, "duration_ms": 1.0 },
    "memory_modules": { "status": "success", "data": [{ "Manufacturer": "RAM Maker", "PartNumber": "RAM-1", "Capacity": 17179869184, "Speed": 6000, "ConfiguredClockSpeed": 6000 }], "message": null, "duration_ms": 1.0 },
    "physical_disks": { "status": "success", "data": [{ "Model": "Test SSD", "InterfaceType": "NVMe", "MediaType": "SSD", "Size": 1000000000000, "Status": "OK" }], "message": null, "duration_ms": 1.0 },
    "uptime": { "status": "success", "data": { "UptimeSeconds": 3600 }, "message": null, "duration_ms": 1.0 }
  }
}
